{
  "schema": "asb.ai/2",
  "verse": {
    "key": "ai:verse:43003016:bsb:bsb-2023:v3",
    "kind": "verse",
    "vid": 43003016,
    "ref": "John.3.16",
    "translation": "bsb",
    "textVersion": "bsb-2023",
    "content": {
      "summary": "Jesus tells Nicodemus that God's love for the world is the reason He gave His one and only Son, and that trusting the Son is what separates perishing from eternal life.",
      "context": "Spoken at night to Nicodemus, a Pharisee (John 3:1-2). It follows the bronze-snake comparison in 3:14-15 (Numbers 21:8-9): as Israel lived by looking at the lifted-up snake, people live by believing in the lifted-up Son.",
      "speaker": "Jesus (to Nicodemus)",
      "genre": "Gospel discourse",
      "themes": [
        "love of God",
        "eternal life",
        "belief",
        "the Son given",
        "the world"
      ],
      "entities": [
        {
          "name": "God",
          "type": "person",
          "role": "giver"
        },
        {
          "name": "the Son",
          "type": "person",
          "alias": "Jesus",
          "role": "given"
        },
        {
          "name": "Nicodemus",
          "type": "person",
          "role": "listener",
          "vid": 43003001
        },
        {
          "name": "the world",
          "type": "group"
        }
      ],
      "questions": [
        "What does 'the world' include here, given 3:17?",
        "How do verses 14-15 set up 'gave' in verse 16?"
      ],
      "readingTip": "Read 3:14-18 as one unit: 'lifted up', 'gave', and 'not condemned' explain each other."
    },
    "provenance": {
      "generator": "claude",
      "model": "claude-opus-5",
      "promptId": "verse-context",
      "promptVersion": "v3",
      "schemaVersion": 2,
      "inputs": {
        "verses": [
          43003014,
          43003015,
          43003016,
          43003017,
          43003018
        ],
        "topConnections": 12,
        "rankingVersion": "asb.rank.v2",
        "translation": "bsb",
        "textVersion": "bsb-2023"
      },
      "inputHash": "sha256:5b1e4c0a9d2f7e6b1c3a8d4f0e9b7a6c5d4e3f2a1b0c9d8e7f6a5b4c3d2e1f0a",
      "generatedAt": "2026-09-20T03:12:44Z",
      "backendJob": "batch_01J8Y2K7",
      "tokens": {
        "input": 1840,
        "output": 212
      },
      "reviewed": false,
      "disclaimer": "AI-generated study aid, not authoritative commentary and not part of the Bible text or the OpenBible dataset."
    },
    "cache": {
      "source": "bundled",
      "fetchedAt": null,
      "ttlDays": null,
      "invalidateOn": [
        "promptVersion",
        "textVersion",
        "rankingVersion"
      ]
    }
  },
  "connection": {
    "key": "ai:edge:43003016>45005008:bsb:bsb-2023:v2",
    "kind": "edge",
    "from": {
      "vid": 43003016,
      "ref": "John.3.16",
      "label": "John 3:16"
    },
    "to": {
      "start": 45005008,
      "end": 45005008,
      "ref": "Rom.5.8",
      "label": "Romans 5:8"
    },
    "direction": "both",
    "votesOut": 178,
    "votesIn": 33,
    "translation": "bsb",
    "textVersion": "bsb-2023",
    "content": {
      "why": "Both verses ground God's love in an act, not a feeling: John says God gave His Son; Paul says Christ died for us while we were still sinners. John states it as Jesus' teaching; Paul states it as the proof of God's love toward sinners.",
      "relation": "parallel",
      "confidence": 0.92,
      "sharedThemes": [
        "love of God",
        "the Son given",
        "sacrifice"
      ],
      "readNext": [
        {
          "to": {
            "start": 62004009,
            "end": 62004010,
            "ref": "1John.4.9-1John.4.10",
            "label": "1 John 4:9–10"
          },
          "why": "Restates both verses with 'sent His Son' and 'atoning sacrifice'."
        },
        {
          "to": {
            "start": 45008032,
            "end": 45008032,
            "ref": "Rom.8.32",
            "label": "Romans 8:32"
          },
          "why": "Paul's own echo of 'gave His Son': 'did not spare His own Son'."
        }
      ]
    },
    "relationVocabulary": [
      "quotation",
      "allusion",
      "fulfillment",
      "parallel",
      "contrast",
      "context",
      "thematic"
    ],
    "provenance": {
      "generator": "claude",
      "model": "claude-opus-5",
      "promptId": "edge-why",
      "promptVersion": "v2",
      "schemaVersion": 2,
      "inputs": {
        "verses": [
          43003016,
          45005008
        ],
        "votesOut": 178,
        "votesIn": 33,
        "translation": "bsb",
        "textVersion": "bsb-2023"
      },
      "inputHash": "sha256:91ad3f0b7c6e5d4a2b1c0d9e8f7a6b5c4d3e2f1a0b9c8d7e6f5a4b3c2d1e0f91",
      "generatedAt": "2026-09-21T11:48:52Z",
      "backendJob": "batch_01J8Y2K7",
      "tokens": {
        "input": 610,
        "output": 96
      },
      "reviewed": false,
      "disclaimer": "AI-generated study aid, not authoritative commentary and not part of the Bible text or the OpenBible dataset."
    },
    "cache": {
      "source": "fetched",
      "fetchedAt": "2026-09-27T14:04:00Z",
      "ttlDays": 365,
      "invalidateOn": [
        "promptVersion",
        "textVersion"
      ]
    }
  },
  "requestOnMiss": {
    "method": "POST",
    "path": "/v1/context",
    "body": {
      "kind": "edge",
      "from": 43003016,
      "to": {
        "start": 45005008,
        "end": 45005008
      },
      "translation": "bsb",
      "textVersion": "bsb-2023",
      "promptVersion": "v2"
    },
    "auth": "App Attest + anonymous device token; the phone never holds an Anthropic API key",
    "policy": "Generated on the backend with the Anthropic API (Batches API for pre-generation). Every AI field renders with an 'AI' marker; model and prompt version shown on long-press."
  },
  "_note": "Illustrative sample written during prototyping to show the shape; vids, refs and votes are real. Not production model output."
}
